{
  "schema": "event/v2",
  "event": "01K1A2B3C4D5E6F7G8H9J0K1M7",
  "space": "checkout-core",
  "subject": "XW-axon-20260808-clos",
  "transition": "close",
  "actor": {
    "kind": "agent",
    "name": "contract-publisher",
    "system": "atlas",
    "model": "codex",
    "session": "session-1"
  },
  "at": "2026-08-03T12:00:00Z",
  "produced_by": {
    "tool": "a2a",
    "version": "0.19.0"
  },
  "state": "closed",
  "verdicts": [
    {
      "index": 0,
      "verdict": "met",
      "cause_owner": "seomatrix"
    }
  ]
}